{
  "kind": "recommendation",
  "schema_version": "1.0.0",
  "recommendation_id": "rec_seed_affinity_web_0001",
  "tenant_id": "tenant_demo",
  "objective_ref": {
    "id": "obj_seed_affinity_web",
    "version": "1.0.0"
  },
  "requested_task": {
    "task_ref": {
      "id": "task_seed_affinity_score",
      "version": "1.0.0"
    },
    "decision_ref": "dec_task_seed_affinity_score_1.0.0_20261014T120000Z",
    "task_family": "seed_affinity",
    "verdict": "ELIGIBLE"
  },
  "recommended_options": [
    {
      "task_ref": {
        "id": "task_seed_affinity_score",
        "version": "1.0.0"
      },
      "decision_ref": "dec_task_seed_affinity_score_1.0.0_20261014T120000Z",
      "task_family": "seed_affinity",
      "position": 1,
      "claim_type": "seed_affinity",
      "fit": "requested",
      "fit_basis": [
        "requested_task",
        "accepted_claim"
      ],
      "cost": {
        "status": "unknown"
      }
    }
  ],
  "unlock_options": [
    {
      "task_ref": {
        "id": "task_score_unregistered_location",
        "version": "1.0.0"
      },
      "decision_ref": "dec_task_score_unregistered_location_1.0.0_20261014T120000Z",
      "task_family": "seed_affinity",
      "reason_codes": [
        "missing_execution_policy"
      ],
      "next_actions": [
        "Obtain an execution policy that addresses this operation and location"
      ]
    },
    {
      "task_ref": {
        "id": "task_quarantine_score",
        "version": "1.0.0"
      },
      "decision_ref": "dec_task_quarantine_score_1.0.0_20261014T120000Z",
      "task_family": "seed_affinity",
      "reason_codes": [
        "unregistered_source_profile"
      ],
      "next_actions": [
        "Complete steward confirmation of the source profile"
      ]
    }
  ],
  "blocked_options": [],
  "ranking_status": "ranked",
  "ranking_basis": "The requested task is listed first. Eligible options matching the requested task family follow, then alternatives that answer a different question. Within a group, options are ordered by known cost only; options with unknown cost share a position.",
  "decision_refs": [
    "dec_task_seed_affinity_score_1.0.0_20261014T120000Z",
    "dec_task_score_unregistered_location_1.0.0_20261014T120000Z",
    "dec_task_quarantine_score_1.0.0_20261014T120000Z"
  ],
  "generated_at": "2026-10-14T12:00:00Z",
  "valid_until": "2026-10-21T12:00:00Z",
  "generated_by": {
    "service_id": "aip-recommender",
    "service_version": "0.1.0",
    "authority": "deterministic_ranker"
  }
}
